{
  "id": "0192cae6-000b-7000-8000-000000000000",
  "skill_id": "validate-skillmd",
  "version_kind": "edit",
  "parent_version_id": null,
  "source_snapshot_hash": "sha256:6666666666666666666666666666666666666666666666666666666666666666",
  "refiner_strategy_id": "skill-opt-style@1",
  "created_at": "2026-05-27T00:00:00Z",
  "created_by": "refiner-worker@intentsolutions.io"
}
