{
  "id": "0192cae6-000b-7000-8000-000000000001",
  "skill_id": "validate-skillmd",
  "version_kind": "edit",
  "parent_version_id": "0192cae6-000b-7000-8000-000000000000",
  "source_snapshot_hash": "sha256:7777777777777777777777777777777777777777777777777777777777777777",
  "refiner_strategy_id": "naive-in-context@1",
  "created_at": "2026-05-27T00:00:00Z",
  "created_by": "jeremy@intentsolutions.io"
}
